题目,A,B,C,D,正确答案,解析连接,图片名称,,,,,
如图，MN和PQ是电阻不计的平行金属导轨，其间距为L，导轨弯曲部分光滑，平直部分粗糙，右端接一个阻值为R的定值电阻．平直部分导轨左边区域有宽度为d、方向竖直向上、磁感应强度大小为B的匀强磁场．质量为m、电阻也为R的金属棒从高为h处静止释放，到达磁场右边界处恰好停止．已知金属棒与平直部分导轨间的动摩擦因数为u，金属棒与导轨间接触良好．则金属棒穿过磁场区域的过程中（ ）,流过金属棒的最大电流为 <img alt="图片_x0020_47" height="38" src="/files/attach/files/content/2020/0324/44e0fbab075ddde209d0b47c9eb1dfd3.png" width="57",通过金属棒的电荷量为 <img alt="图片_x0020_48" height="35" src="/files/attach/files/content/2020/0324/8f60601fd1e36a518e5360c1e28abf28.png" width="29",克服安培力所做的功为mgh,金属棒产生的焦耳热为 <img src="/files/attach/files/content/2020/0324/1585029506.121.png"> mg（hμd）</img,D,https://gz.shuatiw.com/ias/attach/files/content/2020/0324/73ca4aa7f8fe920ef0e6ff8849fc_3376191ex.png,920ef0e6ff8849fc_3376191ex.png,,,,,
如图所示，环形导线中通有顺时针方向的电流I，则该环形导线中心处的磁场方向为（ ）,水平向右,水平向左,垂直于纸面向里,垂直于纸面向外,C,https://gz.shuatiw.com/ias/attach/files/content/2020/0324/8de14bc08504e211e6bc9f344d95_11059646ex.png,211e6bc9f344d95_11059646ex.png,,,,,
如图所示，在垂直于纸面的范围足够大的匀强磁场中，有一个矩形线圈abcd，线圈平面与磁场垂直，O1O2和O3O4都是线圈的对称轴，应使线圈怎样运动才能使其中产生感生电流？（ ）,向左平动,向上或向下平动,向右平动,绕O<sub>1</sub>O<sub>2</sub>转动,D,https://gz.shuatiw.com/ias/attach/files/content/2020/0324/f4b3a29ad344b2e63962d622667e_11959538ex.png,2e63962d622667e_11959538ex.png,,,,,
如图所示电路中，线圈L与灯泡LA并联，当合上开关S后灯LA正常发光．已知，线圈L的电阻小于灯泡LA的电阻．则下列现象可能发生的是(　　),当断开S时，灯泡L<sub>A</sub>立即熄灭,当断开S时，灯泡L<sub>A</sub>突然闪亮一下，然后逐渐熄灭,若把线圈L换成电阻，断开S时，灯泡L<sub>A</sub>逐渐熄灭,若把线圈L换成电阻，断开S时，灯泡L<sub>A</sub>突然闪亮一下，然后逐渐熄灭,B,https://gz.shuatiw.com/ias/attach/files/content/2020/0324/5bf1fbe14b4204e6d76e3021fcc9_11385686ex.png,4e6d76e3021fcc9_11385686ex.png,,,,,
如图所示，闭合圆导线线圈放置在匀强磁场中，线圈平面与磁场平行，其中ac、bd分别是平行、垂直于磁场方向的两条直径．试分析使线圈做如下运动时，能产生感应电流的是（　　）,使线圈匀速向右平移,使线圈加速向右平移,使线圈以ac为轴转动,使线圈以bd为轴转动,D,https://gz.shuatiw.com/ias/attach/files/content/2020/0324/f81ed66ee8bdab754d22365450c1_4509881ex.png,ab754d22365450c1_4509881ex.png,,,,,
如图所示，线框平面与磁场方向垂直，现将线框沿垂直磁场方向拉出磁场的过程中，穿过线框磁通量的变化情况是（　　）,变小,变大,不变,先变小后变大,A,https://gz.shuatiw.com/ias/attach/files/content/2020/0324/641b8b7bb469b7f0150b52c77007_1419755ex.png,b7f0150b52c77007_1419755ex.png,,,,,
如图竖直放置的长直导线ef中通有恒定电流，有一矩形金属线框abcd与导线在同一平面内，在下列情况中矩形线框中不产生感应电流的是（ ）,导线中电流强度变大,线框向右平动,线框以ad边为轴转动,线框以ef为轴转动,D,https://gz.shuatiw.com/ias/attach/files/content/2020/0324/455afacb9d5bb1fd73af17271012_3010313ex.png,b1fd73af17271012_3010313ex.png,,,,,
如图所示，在纸面内放有一个条形磁铁和一个圆形线圈（位于磁铁正中央），下列情况中能使线圈中产生感应电流的是（　　）,将磁铁在纸面内向上平移,将磁铁在纸面内向右平移,将磁铁绕垂直纸面的轴转动,将磁铁的N极转向纸外，S极转向纸内,D,https://gz.shuatiw.com/ias/attach/files/content/2020/0324/eb6edeae14a837ad35b30ab6e91c_4393820ex.png,37ad35b30ab6e91c_4393820ex.png,,,,,
竖直导线ab与水平面上放置的圆线圈隔有一小段距离，其中直导线固定，线圈可自由运动，当同时通以如图所示方向的电流时（圆线圈内电流从上向下看是逆时针方向电流），则从左向右看，线圈将（ ）,不动,顺时针转动，同时靠近导线,顺时针转动，同时离开导线,逆时针转动，同时靠近导线,D,https://gz.shuatiw.com/ias/attach/files/content/2020/0324/3f84b083e9eb41652aec4907d6d7_4887148ex.png,41652aec4907d6d7_4887148ex.png,,,,,
首先发现电流磁效应的科学家是（ ）,安培,爱因斯坦,库仑,奥斯特,D,https://gz.shuatiw.com/ias/attach/files/content/2020/0324/eb13cd4eca64af42b17ca7436476_9047808ex.png,af42b17ca7436476_9047808ex.png,,,,,
1820年丹麦物理学家奥斯特发现了电流的磁效应．在奥斯特实验中，将直导线沿南北方向水平放置，指针靠近直导线，下列结论正确的是（　　）,把小磁针放在导线的延长线上，通电后，小磁针会转动,把小磁针平行地放在导线的下方，在导线与小磁针之间放置一块铝板，通电后，小磁针不会转动,把小磁针平行地放在导线的下方，给导线通以恒定电流，然后逐渐增大导线与小磁针之间的距离，小磁针转动的角度（与通电前相比）会逐渐减小,把黄铜针（用黄铜制成的指针）平行地放在导线的下方，通电后，黄铜针会转动,C,https://gz.shuatiw.com/ias/attach/files/content/2020/0324/eb90687d2a3585365906c61b55d1_1419756ex.png,85365906c61b55d1_1419756ex.png,,,,,
如图，竖直长直导线通以恒定电流I  ， 闭合线圈abcd与直导线在同一平面内，导致圈内磁通量发生变化的线圈运动是（　　）,水平向右平移,竖直向下平移,竖直向上平移,以竖直长直导线为轴转动,A,https://gz.shuatiw.com/ias/attach/files/content/2020/0324/77e5122db26e2ff049843a39961f_1419753ex.png,2ff049843a39961f_1419753ex.png,,,,,
发电机利用水力、风力等动力推动线圈在磁场中转动，将机械能转化为电能．这种转化利用了（ ）,电流的热效应,电磁感应原理,电流的磁效应,磁场对电流的作用原理,B,https://gz.shuatiw.com/ias/attach/files/content/2020/0324/e36f9a5f336eba3397ca8e3c0883_4888054ex.png,ba3397ca8e3c0883_4888054ex.png,,,,,
下列说法正确的是( ),弹簧的劲度系数与弹簧的形变量成正比,法拉第通过实验首先发现了电流的磁效应,动车高速运行时，惯性与静止时一样大,物体受到的静摩擦力方向与其运动方向相反,C,https://gz.shuatiw.com/ias/attach/files/content/2020/0324/c31fb056ee33f58123a2353bffad_2451546ex.png,f58123a2353bffad_2451546ex.png,,,,,
如图所示，A为水平放置的胶木圆盘，在其侧面均匀分布着负电荷，在A的正上方用绝缘丝线悬挂一个金属圆环B，使B的环面水平且与圆盘面平行，其轴线与胶木盘A的轴线OO′重合．现使胶木盘A由静止开始绕其轴线OO′按箭头所示方向加速转动，则（ ）,金属环B的面积有扩大的趋势，丝线受到的拉力增大,金属环B的面积有缩小的趋势，丝线受到的拉力减小,金属环B的面积有扩大的趋势，丝线受到的拉力减小,金属环B的面积有缩小的趋势，丝线受到的拉力增大,B,https://gz.shuatiw.com/ias/attach/files/content/2020/0324/e5fc64eabe43f0fe39cd913e9064_4888470ex.png,f0fe39cd913e9064_4888470ex.png,,,,,
如图所示，螺线管采用双线绕法．条形磁铁从上方插入的过程，关于电阻R上产生的感应电电流说法正确的是（　　）,感应电流的方向a流向b,感应电流的方向b流向a,没有感应电流产生,有感应电流产生，但方向无法确定,C,https://gz.shuatiw.com/ias/attach/files/content/2020/0324/8ec581fb46f0afb0b9a66d4fa533_5264279ex.png,afb0b9a66d4fa533_5264279ex.png,,,,,
如图所示，L为一个带铁芯的线圈，R是纯电阻，两支路的直流电阻相等，那么在接通和断开开关瞬间，两表的读数I1和I2的大小关系分别是（ ）,I<sub>1</sub>＜I<sub>2</sub>  ， I<sub>1</sub>＞I<sub>2</sub,I<sub>1</sub>＞I<sub>2</sub>  ， I<sub>1</sub>＜I<sub>2</sub,I<sub>1</sub>＜I<sub>2</sub>  ， I<sub>1</sub>=I<sub>2</sub,I<sub>1</sub>=I<sub>2</sub>  ， I<sub>1</sub>＜I<sub>2</sub,C,https://gz.shuatiw.com/ias/attach/files/content/2020/0324/a9453b172d0a7f56ec4af34b49c8_4839372ex.png,7f56ec4af34b49c8_4839372ex.png,,,,,
下列说法正确的是（　　）,当一种电荷出现时，必有等量的异种电荷出现；当一种电荷消失时，必有等量的异种电荷消失,摩擦起电现象使本没有电子和质子的物体中产生了电子和质子,两种不同材料的绝缘体互相摩擦后，一定同时带上不等量异种电荷,感应起电现象说明两个不接触的物体间也可以发生电子的转移,C,https://gz.shuatiw.com/ias/attach/files/content/2020/0324/781c9115703741a714ded85d7ab7_4446287ex.png,41a714ded85d7ab7_4446287ex.png,,,,,
下列电器和设备工作时，工作过程与电磁感应现象无关的是（ ）,发电机,电磁炉,变压器,电热水器,D,https://gz.shuatiw.com/ias/attach/files/content/2020/0324/d0ac6c8c94172aaad16f3110039e_4033829ex.png,2aaad16f3110039e_4033829ex.png,,,,,
面积为5×102m2的单匝矩形线圈放在磁感应强度为3×102T的匀强磁场中，当线圈平面与磁场方向垂直时，穿过线圈的磁通量是（　　）,3×10<sup></sup><sup>4</sup><span>Wb</span,2×10<sup></sup><sup>3</sup><span>Wb</span,5×10<sup></sup><sup>2</sup><span>Wb</span,1.5×10<sup></sup><sup>3</sup><span>Wb</span,D,https://gz.shuatiw.com/ias/attach/files/content/2020/0324/d1d7e6a469ba33db604e808c5813_1419762ex.png,33db604e808c5813_1419762ex.png,,,,,
下列现象中属于电磁感应现象的是（ ）,通电导体周围产生磁场,电荷在磁场中定向移动形成电流,闭合线圈中因电流变化而产生感应电动势,磁场对感应电流有作用，阻碍导体和磁场相对运动,C,https://gz.shuatiw.com/ias/attach/files/content/2020/0324/c36c50902b190c43686756f39123_12186186ex.png,c43686756f39123_12186186ex.png,,,,,
如图所示，在条形磁铁N极附近悬挂一个金属闭合线圈，当磁铁运动时，线圈中( ),一定产生感应电流,不一定产生感应电流,不可能产生感应电流,无法确定,A,https://gz.shuatiw.com/ias/attach/files/content/2020/0324/f40557def3dac3d817d3b91669e2_6855771ex.png,c3d817d3b91669e2_6855771ex.png,,,,,
如图所示，匝数为N、半径为r1的圆形线圈内有匀强磁场，匀强磁场在半径为r2的圆形区域内，匀强磁场的磁感应强度B垂直于线圈平面．通过该线圈的磁通量为（　　）,Bπr<sub>1</sub><sup>2</su,Bπr<sub>2</sub><sup>2</su,NBπr<sub>1</sub><sup>2</su,NBπr<sub>2</sub><sup>2</su,B,https://gz.shuatiw.com/ias/attach/files/content/2020/0324/fbf52e688d4692e127a447a5408c_1419760ex.png,92e127a447a5408c_1419760ex.png,,,,,
如图所示，把一条长直导线平行地放在小磁针的上方附近，当导线中有电流通过时，小磁针会发生偏转。首先观察到这个实验现象的物理学家是（ ）,奥斯特,法拉第,洛伦兹,楞次,A,https://gz.shuatiw.com/ias/attach/files/content/2020/0324/0720ebb7c7f26d8249397d138218_6855765ex.png,6d8249397d138218_6855765ex.png,,,,,
下列现象中，属于电磁感应现象的是（ ）,小磁针在通电导线附近发生偏转,通电线圈在磁场中转动,闭合线圈在磁场中运动而产生电流,磁铁吸引小磁针,C,https://gz.shuatiw.com/ias/attach/files/content/2020/0324/8255e4d41ec1d307eb8f8b62af7b_3413819ex.png,d307eb8f8b62af7b_3413819ex.png,,,,,
如图所示，ab为一金属杆，它处在垂直于纸面向里的匀强磁场中，可绕a点在纸面内转动；S为以a为圆心位于纸面内的金属圆环；在杆转动过程中，杆的b端与金属环保持良好接触；A为电流表，其一端与金属环相连，一端与a点良好接触．当杆沿顺时针方向转动时，某时刻ab杆的位置如图，则此时刻（　　）,有电流通过电流表，方向由c→d；作用于ab的安培力向右,有电流通过电流表，方向由c→d；作用于ab的安培力向左,有电流通过电流表，方向由d→c；作用于ab的安培力向右,无电流通过电流表，作用于ab的安培力为零,A,https://gz.shuatiw.com/ias/attach/files/content/2020/0324/4eb160ddff47232e426b8d82e8b0_4508007ex.png,232e426b8d82e8b0_4508007ex.png,,,,,
如图所示，边长为L的正方形导线框其质量为m，在距磁场上边界高H处自由下落，其下边框ab进入匀强磁场后，线圈开始做减速运动，直到其上边框cd刚穿出磁场时，其速度减为ab边刚进入磁场时的一半，磁场的宽度也为L，则线框穿越匀强磁场过程中产生的焦耳热为（ ）,2mgL,2mgL+mgH,2mgL+ <img src="/files/attach/files/content/2020/0324/1585029433.535.png"> mgH</img,2mgL+ <img src="/files/attach/files/content/2020/0324/1585029434.094.png"> mgH</img,C,https://gz.shuatiw.com/ias/attach/files/content/2020/0324/c36b03f69aa17d3c6103f7ac8f59_4840914ex.png,7d3c6103f7ac8f59_4840914ex.png,,,,,
如图所示，在载流直导线近旁固定有两平行光滑导轨A、B，导轨与直导线平行且在同一水平面内，在导轨上有两可自由滑动的导体ab和cd．当载流直导线中的电流逐渐增强时，导体ab和cd的运动情况是（　　）,一起向左运动,一起向右运动,ab和cd相向运动，相互靠近,ab和cd相背运动，相互远离,C,https://gz.shuatiw.com/ias/attach/files/content/2020/0324/ec26b54e6a3c151cdaac5b9f55af_4508005ex.png,151cdaac5b9f55af_4508005ex.png,,,,,
如图所示，一个导线框在匀强磁场中向垂直于磁感线的方向运动，导线中会不会产生感应电流( ),一定不会,一定会,可能会,可能不会,A,https://gz.shuatiw.com/ias/attach/files/content/2020/0324/7bda4ca73c4339e86f77e8e5e596_10026652ex.png,9e86f77e8e5e596_10026652ex.png,,,,,
如图所示，线圈abcd水平向右穿过磁场区域B时，在以下情况中，线圈中有感应电流产生的是（ ）,整个线圈都在磁场中上下平动,整个线圈都在磁场中左右平动,线圈离开磁场的过程中,线圈进入磁场后在它所在的平面内绕a点旋转,C,https://gz.shuatiw.com/ias/attach/files/content/2020/0324/301ee5a24b9bc19bf0ab91b9ca9c_4839300ex.png,c19bf0ab91b9ca9c_4839300ex.png,,,,,
首先发现电流的磁效应和电磁感应的物理学家分别是（ ）,安培和法拉第,法拉第和楞次,奥斯特和安培,奥斯特和法拉第,D,https://gz.shuatiw.com/ias/attach/files/content/2020/0324/0a3e1d734a390c4d4309e9ba882d_3413428ex.png,0c4d4309e9ba882d_3413428ex.png,,,,,
如图所示，闭合金属圆环下落过程中，穿过竖直放置的条形磁铁正中间位置时，下列说法正确的是（　　）,金属圆环的加速度等于<span>g</span,穿过金属圆环的磁通量为零,穿过金属圆环的磁通量变化率不为零,金属圆环沿半径方向有收缩的趋势,A,https://gz.shuatiw.com/ias/attach/files/content/2020/0324/d3ad9ba9909270984a2d63c7bace_1419761ex.png,70984a2d63c7bace_1419761ex.png,,,,,
在电磁感应现象中，下列说法正确的是（　　）,导体相对磁场运动，导体内一定产生感应电流,导体做切割磁感线运动，导体内一定会产生感应电流,闭合电路在磁场内做切割磁感线运动，导体内一定会产生感应电流,穿过闭合电路的磁通量发生变化，在电路中一定会产生感应电流,D,https://gz.shuatiw.com/ias/attach/files/content/2020/0324/b9fe4ac8382c0ce64578a4ae1ae9_4508001ex.png,0ce64578a4ae1ae9_4508001ex.png,,,,,
如图所示一个矩形线圈abcd放在垂直纸面向里的匀强磁场中，在进行下列操作时，整个线圈始终处于磁场之内，线圈中能产生感应电流的是（ ）,线圈沿纸面向右移动,线圈沿纸面向下移动,线圈垂直纸面向外移动,线圈以ab边为轴转动,D,https://gz.shuatiw.com/ias/attach/files/content/2020/0324/b4e94a8edd4039b0cd5089f18341_4119954ex.png,39b0cd5089f18341_4119954ex.png,,,,,
图所示的磁场中，有三个面积相同且相互平行的线圈S1、S2和S3  ， 穿过S1、S2和S3的磁通量分别为Φ1、Φ2和Φ3  ， 下列判断正确的是（　　）,span>Φ<sub>1</sub></span>最大,span>Φ<sub>2</sub></span>最大,span>Φ<sub>3</sub></span>最大,span>Φ<sub>1</sub>=Φ<sub>2</sub>=Φ<sub>3</sub></span,C,https://gz.shuatiw.com/ias/attach/files/content/2020/0324/9e284e9a25a428c00d2aca7cb8d4_1419752ex.png,28c00d2aca7cb8d4_1419752ex.png,,,,,
如图所示，匀强磁场中有两个导体圆环a、b，磁场方向与圆环所在平面垂直。磁感应强度B随时间均匀增大。两圆坏半径之比为2:1，圆环中产生的感应电动势分别为Ea和Eb  ， 不考虑两圆环间的相互影响。下列说法正确的是（ ）,E<sub>a</sub>:E<sub>b</sub>=4:1，感应电流均沿逆时针方向,E<sub>a</sub>:E<sub>b</sub>=4:1，感应电流均沿顺时针方向,E<sub>a</sub>:E<sub>b</sub>=2:1，感应电流均沿逆时针方向,E<sub>a</sub>:E<sub>b</sub>=2:1，感应电流均沿顺时针方向,B,https://gz.shuatiw.com/ias/attach/files/content/2020/0324/458eb6d695ef0d6c7c6095f1bb84_2547754ex.png,0d6c7c6095f1bb84_2547754ex.png,,,,,
下列现象中属于电磁感应现象的是（ ）,磁场对电流产生力的作用,变化的磁场使闭合电路中产生电流,插在通电螺线管中的软铁棒被磁化,通电直导线使其旁边的小磁针发生偏转,B,https://gz.shuatiw.com/ias/attach/files/content/2020/0324/5b0aa7db133993964205c8988b58_10632174ex.png,3964205c8988b58_10632174ex.png,,,,,
关于产生感应电流的条件，下述说法正确的是（ ）,位于磁场中的闭合线圈，一定能产生感应电流,闭合线圈和磁场发生相对运动，一定能产生感应电流,闭合线圈做切割磁感线运动，一定能产生感应电流,穿过闭合线圈的磁感线条数发生变化，一定能产生感应电流,D,https://gz.shuatiw.com/ias/attach/files/content/2020/0324/c499b9c79aa931c189782fcda5aa_6855817ex.png,31c189782fcda5aa_6855817ex.png,,,,,
如图所示,有一正方形闭合线圈,在足够大的匀强磁场中运动.下列四个图中能产生感应电流的是（ ）,矩形线圈平行于磁场向右平移 <img height="90" src="/files/attach/files/content/2020/0324/82950e53b60b73d9ca62a3703a38df47.jpg" v:shapes="图片_x0020_1" width="108",矩形线圈垂直于磁场向右平移 <img height="94" src="/files/attach/files/content/2020/0324/2effc7f0fb4a79261df8d5dec67391f9.jpg" v:shapes="图片_x0020_2" width="126",矩形线圈绕水平轴<i>OO′</i>匀速转动 <img height="93" src="/files/attach/files/content/2020/0324/c90502d74bf21ddc68cbeb1c6771b76e.jpg" v:shapes="图片_x0020_3" width="134",矩形线圈绕竖直轴<i>OO′</i>匀速转动 <img height="108" src="/files/attach/files/content/2020/0324/6f40fe5570149bde0c3d306adfb5b4bb.jpg" v:shapes="图片_x0020_4" width="122",D,https://gz.shuatiw.com/ias/attach/files/content/2020/0324/c6e7688ca40c27ec3a76a70e8341_11991638ex.png,7ec3a76a70e8341_11991638ex.png,,,
如图所示，abcd为水平放置的平行“l。导轨间有垂直于导轨平面的匀强磁场，磁感应强度大小为B，导轨电阻不计。已知金属杆MN倾斜放置，与导轨成角，单位长度的电阻为r，保持金属杆以速度v沿平行于cd的方向滑动（金属杆滑动过程中与导轨接触良好）。则（ ）,电路中感应电动势的大小为<img src="/files/attach/files/content/2020/0324/1585029406.542.png",电路中感应电流的大小为<img src="/files/attach/files/content/2020/0324/1585029407.248.png",金属杆所受安培力的大小为<img src="/files/attach/files/content/2020/0324/1585029407.463.png",金属杆的热功率为<img src="/files/attach/files/content/2020/0324/1585029408.165.png",B,https://gz.shuatiw.com/ias/attach/files/content/2020/0324/31f14e29f282a06008a3ad264118_1211942ex.png,a06008a3ad264118_1211942ex.png,,,,,
如图所示，电源的电动势为E、内阻为r，L1、L2为两个相同的灯泡，线圈L的直流电阻不计，与灯泡L1连接的是一只理想二极管D.下列说法中正确的是（ ）,闭合开关S稳定后L<sub>1</sub>、L<sub>2</sub>亮度相同,断开S的瞬间，L<sub>2</sub>会逐渐熄灭,断开S的瞬间，L<sub>1</sub>中电流方向向左,断开S的瞬间，a点的电势比b点高,D,https://gz.shuatiw.com/ias/attach/files/content/2020/0324/48af13125384613b6ca8e788f9d8_10556016ex.png,13b6ca8e788f9d8_10556016ex.png,,,,,
如图所示，一个有界匀强磁场区域，磁场方向垂直纸面向外．一个矩形闭合导线框abcd，沿纸面由位置1（左）匀速运动到位置2（右）．则g（ ）,导线框进入磁场时，感应电流方向为a→b→c→d→a,导线框离开磁场时，感应电流方向为a→d→c→b→a,导线框离开磁场时，受到的安培力方向水平向左,导线框进入磁场时，受到的安培力方向水平向右,C,https://gz.shuatiw.com/ias/attach/files/content/2020/0324/9119c2c10338c0e78f5370d52f8c_4840484ex.png,c0e78f5370d52f8c_4840484ex.png,,,,,
如图所示，金属导轨上的导体棒ab在匀强磁场中沿导轨做下列哪种运动时，铜制线圈c中将有感应电流产生且被螺线管吸引（ ）,向右做匀速运动,向左做匀速运动,向右做减速运动,向右做加速运动,C,https://gz.shuatiw.com/ias/attach/files/content/2020/0324/302651bb51ed4f9d9440541aa1bf_4889922ex.png,4f9d9440541aa1bf_4889922ex.png,,,,,
如图所示，匀强磁场的方向垂直于光滑的金属导轨平面向里，极板间距为d的平行板电容器与总阻值为2R0的滑动变阻器通过平行导轨连接，电阻为R0的导体棒MN可在外力的作用下沿导轨从左向右做匀速直线运动。当滑动变阻器的滑动触头位于a、b的中间位置、导体棒MN的速度为v0时，位于电容器中P点的带电油滴恰好处于静止状态．若不计摩擦和平行导轨及导线的电阻，重力加速度为g，则下列判断正确的是（）,油滴带正电荷,若将上极板竖直向上移动距离d，油滴将向上加速运动，加速度<img src="/files/attach/files/content/2020/0324/1585029396.935.png",若将导体棒的速度变为2v<sub>0</sub>  ， 油滴将向上加速运动，加速度a=2g,若保持导体棒的速度为v<sub>0</sub>不变，而将滑动触头置于a位置，同时将电容器上极板向上移动距离d／3，油滴仍将静止,D,https://gz.shuatiw.com/ias/attach/files/content/2020/0324/ad9a469d624e3fc59d660a0bbcb4_1019479ex.png,3fc59d660a0bbcb4_1019479ex.png,,,,,
两根相距为L的足够长的金属弯角光滑导轨如图所示放置，它们各有一边在同一水平面内，另一边与水平面的夹角为37°，质量均为m的金属细杆ab、cd与导轨垂直接触形成闭合回路，导轨的电阻不计，回路总电阻为2R，整个装置处于磁感应强度大小为B，方向竖直向上的匀强磁场中，当ab杆在平行于水平导轨的拉力F作用下以速度v沿导轨匀速运动时，cd杆恰好处于静止状态，重力加速度为g，以下说法正确的是（）,ab杆所受拉力F的大小为mg sin37°,回路中电流为<img src="/files/attach/files/content/2020/0324/1585029388.915.png",回路中电流的总功率为mgv sin37°,m与v大小的关系为m＝<img src="/files/attach/files/content/2020/0324/1585029390.233.png",D,https://gz.shuatiw.com/ias/attach/files/content/2020/0324/90a85e76d85accf4ce1ce9b6916f_954455ex.png,accf4ce1ce9b6916f_954455ex.png,,,,,
下列说法正确的是（ ）,气体分子的体积等于气体的摩尔体积与阿伏加德罗常数之比,空气中水蒸气的实际压强与饱和汽压相差越大，水越难蒸发,叶面上的小露珠呈球形主要是水的表面张力作用,单晶体的各种物理性质都具有各向异性的特征,C,https://gz.shuatiw.com/ias/attach/files/content/2020/0324/2c7a6710ff17a0f2a71047e5e193_12375556ex.png,0f2a71047e5e193_12375556ex.png,,,,,
某种油剂的密度为  ， 若不慎将0.8kg这种油剂漏到湖水中并形成单分子油膜，则湖面受污染面积约为(　　),img src="/files/attach/files/content/2020/0324/1585030683.060.png",img src="/files/attach/files/content/2020/0324/1585030683.775.png",img src="/files/attach/files/content/2020/0324/1585030684.482.png",img src="/files/attach/files/content/2020/0324/1585030685.620.png",C,https://gz.shuatiw.com/ias/attach/files/content/2020/0324/93cd608a5eae182cea81c24f1911_1023400ex.png,182cea81c24f1911_1023400ex.png,,,,,
下列说法正确的是（ ）,油膜法实验时应先将-滴油酸酒精溶液滴入水面，再把痱子粉酒在水面上,已知氧气的摩尔体积和阿伏加德罗常数，可求氧分子的体积,液体中悬浮微粒的布朗运动是液体分子对它的撞击作用不平衡的结果,用打气筒的活塞压缩气体很费力，说明分子间有斥力,C,https://gz.shuatiw.com/ias/attach/files/content/2020/0324/2fd02b349f157217efe2a0e3a72d_17155877ex.png,217efe2a0e3a72d_17155877ex.png,,,,,
已知地球的半径为6.4×103km，水的摩尔质量为1.8×10-2kg/mol，阿伏加德罗常数为6.02×1023个/mol,设想将1g水均匀地分布在地球表面，估算1m2的地球表面上分布的水分数目约为（ ）,7×10<sup>7</sup>个,3×10<sup>8</sup>个,3×10<sup>11</sup>个,7×10<sup>10</sup>个,A,https://gz.shuatiw.com/ias/attach/files/content/2020/0324/8221d114536c6749686339fd7db8_14350941ex.png,749686339fd7db8_14350941ex.png,,,,
